{
  "t_ms": 1015,
  "seq": 15,
  "block": 0,
  "trial": 0,
  "type": "breath_env",
  "data": {
    "t0_ms": 40000,
    "fs_hz": 20,
    "values": [
      0.5,
      0.519,
      0.538,
      0.556,
      0.575,
      0.593,
      0.61,
      0.628,
      0.645,
      0.661,
      0.676,
      0.691,
      0.705,
      0.719,
      0.731,
      0.743,
      0.753,
      0.763,
      0.771,
      0.779
    ],
    "source": "mic"
  }
}
